{
  "schema_version": "1.0",
  "privacy": {
    "paths": "basename-only",
    "url_credentials": "redacted",
    "url_queries": "redacted",
    "secret_assignments": "<redacted>",
    "content_hashing": "sha256-opt-in"
  },
  "plan": {
    "workflow": "compress",
    "command": [
      "ffmpeg",
      "-n",
      "-nostdin",
      "-progress",
      "pipe:1",
      "-nostats",
      "-i",
      "<path>/sample_mp4_h264.mp4",
      "-c:v",
      "libx264",
      "-b:v",
      "2472468",
      "-preset",
      "medium",
      "-pass",
      "1",
      "-passlogfile",
      "<pyffmpegcore-passlog>",
      "-an",
      "-f",
      "null",
      "<path>/null"
    ],
    "inputs": [
      "<path>/sample_mp4_h264.mp4"
    ],
    "outputs": [
      "<path>/output.mp4"
    ],
    "policy": {
      "overwrite": "refuse",
      "timeout_seconds": null,
      "stdout": "tail",
      "stderr": "tail",
      "capture_tail_chars": 16384,
      "temporary_files": "clean"
    },
    "required_capabilities": [
      "encoder:libx264",
      "encoder:aac"
    ],
    "selected_streams": [
      "video",
      "audio"
    ],
    "operations": [
      "fit output under 2097152 bytes",
      "reserve 128k audio and 7% container overhead",
      "two-pass video bitrate: 2472468 bps",
      "quality floor: 100000 bps"
    ],
    "steps": [
      {
        "name": "analysis-pass",
        "command": [
          "ffmpeg",
          "-n",
          "-nostdin",
          "-progress",
          "pipe:1",
          "-nostats",
          "-i",
          "<path>/sample_mp4_h264.mp4",
          "-c:v",
          "libx264",
          "-b:v",
          "2472468",
          "-preset",
          "medium",
          "-pass",
          "1",
          "-passlogfile",
          "<pyffmpegcore-passlog>",
          "-an",
          "-f",
          "null",
          "<path>/null"
        ]
      },
      {
        "name": "encode-pass",
        "command": [
          "ffmpeg",
          "-n",
          "-nostdin",
          "-progress",
          "pipe:1",
          "-nostats",
          "-i",
          "<path>/sample_mp4_h264.mp4",
          "-c:v",
          "libx264",
          "-b:v",
          "2472468",
          "-preset",
          "medium",
          "-pass",
          "2",
          "-passlogfile",
          "<pyffmpegcore-passlog>",
          "-pix_fmt",
          "yuv420p",
          "-c:a",
          "aac",
          "-b:a",
          "128k",
          "-movflags",
          "+faststart",
          "<path>/output.mp4"
        ]
      }
    ],
    "warnings": [],
    "metadata": {
      "structured_progress": true,
      "required_stream_types": [
        "video"
      ],
      "estimated_output_bytes": 2097152,
      "target_size_bytes": 2097152,
      "minimum_feasible_bytes": 183871,
      "duration_seconds": 6.0,
      "temporary_placeholders": [
        "<pyffmpegcore-passlog>"
      ]
    },
    "schema_version": "1.0"
  },
  "tools": {
    "pyffmpegcore": "0.3.1",
    "python": "3.14.6",
    "platform": "macOS-26.6-arm64-arm-64bit-Mach-O",
    "ffmpeg": "ffmpeg version 9.0.1 Copyright (c) 2000-2026 the FFmpeg developers",
    "ffprobe": "ffprobe version 9.0.1 Copyright (c) 2007-2026 the FFmpeg developers"
  },
  "summary": {
    "total": 1,
    "succeeded": 1,
    "failed": 0
  },
  "items": [
    {
      "input_probe": {
        "path": "<path>/sample_mp4_h264.mp4",
        "format_name": "mov,mp4,m4a,3gp,3g2,mj2",
        "duration": 6.0,
        "size_bytes": 4042503,
        "bit_rate": 5390004,
        "streams": [
          {
            "index": 0,
            "type": "video",
            "codec": "h264",
            "width": 1920,
            "height": 1080,
            "sample_rate": null,
            "channels": null,
            "language": "und",
            "rotation": null
          },
          {
            "index": 1,
            "type": "audio",
            "codec": "aac",
            "width": null,
            "height": null,
            "sample_rate": 44100,
            "channels": 1,
            "language": "und",
            "rotation": null
          }
        ],
        "chapter_count": 0
      },
      "output_probe": {
        "path": "<path>/output.mp4",
        "format_name": "mov,mp4,m4a,3gp,3g2,mj2",
        "duration": 6.0,
        "size_bytes": 1984802,
        "bit_rate": 2646402,
        "streams": [
          {
            "index": 0,
            "type": "video",
            "codec": "h264",
            "width": 1920,
            "height": 1080,
            "pixel_format": "yuv420p",
            "sample_rate": null,
            "channels": null,
            "language": "und",
            "rotation": null
          },
          {
            "index": 1,
            "type": "audio",
            "codec": "aac",
            "width": null,
            "height": null,
            "pixel_format": null,
            "sample_rate": 44100,
            "channels": 1,
            "language": "und",
            "rotation": null
          }
        ],
        "chapter_count": 0
      },
      "proof": {
        "input_size_bytes": 4042503,
        "output_size_bytes": 1984802,
        "size_change_bytes": -2057701,
        "reduction_percent": 50.9,
        "target_size_bytes": 2097152,
        "target_met": true
      },
      "preflight": {
        "schema_version": "1.0",
        "workflow": "compress",
        "ok": true,
        "checks": [
          {
            "name": "ffmpeg",
            "status": "pass",
            "message": "Executable: /opt/homebrew/bin/ffmpeg",
            "hint": null
          },
          {
            "name": "capability/encoder:libx264",
            "status": "pass",
            "message": "Available",
            "hint": null
          },
          {
            "name": "capability/encoder:aac",
            "status": "pass",
            "message": "Available",
            "hint": null
          },
          {
            "name": "input/<path>/sample_mp4_h264.mp4",
            "status": "pass",
            "message": "Input is readable",
            "hint": null
          },
          {
            "name": "streams/<path>/sample_mp4_h264.mp4",
            "status": "pass",
            "message": "Required streams available: video",
            "hint": null
          },
          {
            "name": "output/<path>/output.mp4",
            "status": "pass",
            "message": "Output parent is writable: <path>",
            "hint": null
          },
          {
            "name": "collision/<path>/output.mp4",
            "status": "pass",
            "message": "No blocking output collision",
            "hint": null
          },
          {
            "name": "disk/<path>/output.mp4",
            "status": "pass",
            "message": "Free space 162800603136 bytes; estimate 2097152",
            "hint": null
          },
          {
            "name": "container/<path>/output.mp4",
            "status": "pass",
            "message": "Muxer available: mp4",
            "hint": null
          }
        ]
      },
      "result": {
        "workflow": "compress",
        "status": "succeeded",
        "exit_category": "ok",
        "returncode": 0,
        "elapsed_seconds": 3.415965791034978,
        "progress": {
          "schema_version": "1.0",
          "sequence": 4,
          "status": "end",
          "frame": 144,
          "time_seconds": 6.0,
          "speed": 3.11,
          "item": "encode-pass"
        },
        "warnings": []
      }
    }
  ],
  "content_hashes": [
    {
      "path": "<path>/sample_mp4_h264.mp4",
      "algorithm": "sha256",
      "digest": "3026484a0e532d9d23df7874c672dcd9b34089f8cf210d1a1a180093d464ce8a"
    },
    {
      "path": "<path>/output.mp4",
      "algorithm": "sha256",
      "digest": "ed2d96301c53bb8445ed0c7716690ab323ebc56a77ab9708a8d5e7759558e600"
    }
  ]
}
